id;Name;Reference;Category;Description;Quantity;ProductUrl;ImageUrl;Price;SalePrice;ProductFeatures;ProductCombinations;AvailableNow;AvailableForOrder
1;Faded Short Sleeve T-shirts;demo_1;tshirts; Faded short sleeve t-shirt with high neckline. Soft and stretchy material for a comfortable fit. Accessorize with a straw hat and you're ready for summer! ;1799;http://tastehit/tshirts/1-faded-short-sleeve-tshirts.html;tastehit/1/faded-short-sleeve-tshirts.jpg;16.51;19.812;Compositions - Cotton,Styles - Casual,Properties - Short Sleeve;Size - S,Color - Orange,Size - S,Color - Blue,Size - M,Color - Orange,Size - M,Color - Blue,Size - L,Color - Orange,Size - L,Color - Blue;In stock;1
2;Blouse;demo_2;blouses; Short sleeved blouse with feminine draped sleeve detail. ;1799;http://tastehit/blouses/2-blouse.html;tastehit/7/blouse.jpg;26.999852;32.399822;Compositions - Cotton,Styles - Casual,Properties - Short Sleeve;Size - S,Color - Black,Size - S,Color - White,Size - M,Color - Black,Size - M,Color - White,Size - L,Color - Black,Size - L,Color - White;In stock;1
3;Printed Dress;demo_3;casual-dresses; 100% cotton double printed dress. Black and white striped top and orange high waisted skater skirt bottom. ;899;http://tastehit/casual-dresses/3-printed-dress.html;tastehit/8/printed-dress.jpg;25.999852;31.199822;Compositions - Cotton,Styles - Girly,Properties - Colorful Dress;Size - S,Color - Orange,Size - M,Color - Orange,Size - L,Color - Orange;In stock;1
4;Printed Dress;demo_4;evening-dresses; Printed evening dress with straight sleeves with black thin waist belt and ruffled linings. ;900;http://tastehit/evening-dresses/4-printed-dress.html;tastehit/10/printed-dress.jpg;50.994153;61.192984;Compositions - Viscose,Styles - Dressy,Properties - Short Dress;Size - S,Color - Beige,Size - M,Color - Beige,Size - L,Color - Beige,Size - S,Color - Pink,Size - M,Color - Pink,Size - L,Color - Pink;In stock;1
5;Printed Summer Dress;demo_5;summer-dresses; Long printed dress with thin adjustable straps. V-neckline and wiring under the bust with ruffles at the bottom of the dress. ;3600;http://tastehit/summer-dresses/5-printed-summer-dress.html;tastehit/12/printed-summer-dress.jpg;28.981005;34.777206;Compositions - Viscose,Styles - Casual,Properties - Maxi Dress;Size - S,Color - Yellow,Size - S,Color - Blue,Size - S,Color - Orange,Size - S,Color - Black,Size - M,Color - Yellow,Size - M,Color - Blue,Size - M,Color - Orange,Size - M,Color - Black,Size - L,Color - Yellow,Size - L,Color - Blue,Size - L,Color - Orange,Size - L,Color - Black;In stock;1
6;Printed Summer Dress;demo_6;summer-dresses; Sleeveless knee-length chiffon dress. V-neckline with elastic under the bust lining. ;900;http://tastehit/summer-dresses/6-printed-summer-dress.html;tastehit/16/printed-summer-dress.jpg;30.502569;36.603083;Compositions - Polyester,Styles - Girly,Properties - Short Dress;Size - S,Color - Yellow,Size - M,Color - Yellow,Size - L,Color - Yellow,Size - S,Color - White,Size - M,Color - White,Size - L,Color - White;In stock;1
7;Printed Chiffon Dress;demo_7;summer-dresses; Printed chiffon knee length dress with tank straps. Deep v-neckline. ;1800;http://tastehit/summer-dresses/7-printed-chiffon-dress.html;tastehit/20/printed-chiffon-dress.jpg;16.400989;19.681187;Compositions - Polyester,Styles - Girly,Properties - Midi Dress;Size - S,Color - Yellow,Size - M,Color - Yellow,Size - L,Color - Yellow,Size - S,Color - Green,Size - M,Color - Green,Size - L,Color - Green;In stock;1
